[
  {
    "pattern_id": "PAT_GAME_LOOP",
    "engine": "unity",
    "language": "csharp",
    "code": "// Unity's game loop is implicit:\n// FixedUpdate() â€” fixed timestep (physics)\n// Update() â€” once per frame (gameplay)\n// LateUpdate() â€” after all Update calls (camera)\nvoid FixedUpdate() { /* physics logic */ }\nvoid Update() { /* input + gameplay */ }\nvoid LateUpdate() { /* camera follow */ }",
    "notes": "Time.fixedDeltaTime defaults to 0.02s (50Hz). Time.deltaTime for frame-rate-independent movement. Use Time.timeScale for pause."
  },
  {
    "pattern_id": "PAT_GAME_LOOP",
    "engine": "unreal",
    "language": "cpp",
    "code": "// UE5 Tick function â€” called every frame\nvoid AMyActor::Tick(float DeltaTime) {\n    Super::Tick(DeltaTime);\n    // Gameplay logic here\n}\n// Physics runs on a fixed sub-step internally\n// Configure in Project Settings > Physics > Substepping",
    "notes": "UE5 uses variable tick by default. Enable substepping for deterministic physics. TickInterval can throttle per-actor tick rate."
  },
  {
    "pattern_id": "PAT_GAME_LOOP",
    "engine": "godot",
    "language": "gdscript",
    "code": "# Godot's game loop:\n# _physics_process(delta) â€” fixed timestep (default 60Hz)\n# _process(delta) â€” once per frame (variable)\nfunc _physics_process(delta: float) -> void:\n    # Physics and gameplay logic\n    pass\nfunc _process(delta: float) -> void:\n    # Rendering, UI, input\n    pass",
    "notes": "Physics tick rate set in Project Settings > Physics > Common > Physics Ticks Per Second. Use delta for frame-independent math."
  },
  {
    "pattern_id": "PAT_OBJECT_POOL",
    "engine": "unity",
    "language": "csharp",
    "code": "using UnityEngine.Pool;\n\nvar pool = new ObjectPool<GameObject>(\n    createFunc: () => Instantiate(prefab),\n    actionOnGet: obj => obj.SetActive(true),\n    actionOnRelease: obj => obj.SetActive(false),\n    actionOnDestroy: obj => Destroy(obj),\n    defaultCapacity: 20,\n    maxSize: 100\n);\nvar bullet = pool.Get();\n// When done: pool.Release(bullet);",
    "notes": "Built-in since Unity 2021. Pre-warm with Get/Release loops at scene start. maxSize silently destroys overflow objects."
  },
  {
    "pattern_id": "PAT_OBJECT_POOL",
    "engine": "unreal",
    "language": "cpp",
    "code": "// UE5 doesn't have a built-in pool â€” use actor recycling:\nTArray<AActor*> Pool;\n\nAActor* GetFromPool() {\n    for (auto* A : Pool) {\n        if (A->IsHidden()) {\n            A->SetActorHiddenInGame(false);\n            A->SetActorEnableCollision(true);\n            return A;\n        }\n    }\n    return GetWorld()->SpawnActor<AMyProjectile>();\n}",
    "notes": "Disable tick and collision on pooled actors. Use SetActorTickEnabled(false). Consider UE5's FObjectPool for UObject pooling."
  },
  {
    "pattern_id": "PAT_OBJECT_POOL",
    "engine": "godot",
    "language": "gdscript",
    "code": "var pool: Array[Node] = []\nvar prefab: PackedScene = preload(\"res://bullet.tscn\")\n\nfunc get_pooled() -> Node:\n    for obj in pool:\n        if not obj.visible:\n            obj.visible = true\n            return obj\n    var new_obj = prefab.instantiate()\n    pool.append(new_obj)\n    add_child(new_obj)\n    return new_obj\n\nfunc release(obj: Node) -> void:\n    obj.visible = false",
    "notes": "Use set_process(false) and set_physics_process(false) on released objects. Pre-instantiate during _ready() for stutter-free gameplay."
  },
  {
    "pattern_id": "PAT_OBSERVER",
    "engine": "unity",
    "language": "csharp",
    "code": "// C# events (preferred over UnityEvent for code-only):\npublic static event Action<int> OnScoreChanged;\n\n// Raise: OnScoreChanged?.Invoke(newScore);\n// Subscribe: OnScoreChanged += HandleScore;\n// Unsubscribe in OnDestroy: OnScoreChanged -= HandleScore;",
    "notes": "Always unsubscribe in OnDestroy to prevent memory leaks. For designer-facing events, use UnityEvent with Inspector binding."
  },
  {
    "pattern_id": "PAT_OBSERVER",
    "engine": "unreal",
    "language": "cpp",
    "code": "// UE5 Delegates:\nDECLARE_DYNAMIC_MULTICAST_DELEGATE_OneParam(FOnScoreChanged, int32, NewScore);\n\nUPROPERTY(BlueprintAssignable)\nFOnScoreChanged OnScoreChanged;\n\n// Broadcast: OnScoreChanged.Broadcast(NewScore);\n// Subscribe: Obj->OnScoreChanged.AddDynamic(this, &AMyActor::HandleScore);",
    "notes": "Use DYNAMIC delegates for Blueprint binding, non-dynamic for C++-only (faster). Always unbind in EndPlay."
  },
  {
    "pattern_id": "PAT_OBSERVER",
    "engine": "godot",
    "language": "gdscript",
    "code": "# Godot Signals (first-class observer pattern):\nsignal score_changed(new_score: int)\n\n# Emit: score_changed.emit(new_score)\n# Connect: emitter.score_changed.connect(_on_score_changed)\n# Disconnect: emitter.score_changed.disconnect(_on_score_changed)",
    "notes": "Signals are Godot's native observer pattern. Connect in _ready(), disconnect automatically on free(). Use @export for editor-connectable signals."
  },
  {
    "pattern_id": "PAT_COMMAND",
    "engine": "unity",
    "language": "csharp",
    "code": "public interface ICommand {\n    void Execute();\n    void Undo();\n}\npublic class MoveCommand : ICommand {\n    Transform target; Vector3 prev;\n    public MoveCommand(Transform t, Vector3 to) {\n        target = t; prev = t.position;\n    }\n    public void Execute() => target.position = newPos;\n    public void Undo() => target.position = prev;\n}",
    "notes": "Store commands in a Stack for undo. Use for input replay, networked action queues, and level editor operations."
  },
  {
    "pattern_id": "PAT_COMMAND",
    "engine": "unreal",
    "language": "cpp",
    "code": "// UE5 uses GEditor transactions for editor undo:\nclass FMyCommand {\npublic:\n    virtual void Execute() = 0;\n    virtual void Undo() = 0;\n};\n// For gameplay: TArray<TUniquePtr<FMyCommand>> History;\n// History.Add(MakeUnique<FMoveCommand>(Actor, NewPos));\n// History.Last()->Execute();",
    "notes": "UE5 Editor has built-in transaction system (GEditor->BeginTransaction). For gameplay undo, roll your own command stack."
  },
  {
    "pattern_id": "PAT_COMMAND",
    "engine": "godot",
    "language": "gdscript",
    "code": "class_name Command extends RefCounted\nfunc execute() -> void: pass\nfunc undo() -> void: pass\n\nclass_name MoveCommand extends Command\nvar target: Node3D\nvar old_pos: Vector3\nvar new_pos: Vector3\nfunc execute() -> void: target.position = new_pos\nfunc undo() -> void: target.position = old_pos",
    "notes": "Use an Array[Command] as a history stack. Godot's UndoRedo class provides built-in undo for editor plugins."
  },
  {
    "pattern_id": "PAT_STATE_MACHINE",
    "engine": "unity",
    "language": "csharp",
    "code": "public enum EnemyState { Idle, Chase, Attack }\nEnemyState state = EnemyState.Idle;\n\nvoid Update() {\n    switch (state) {\n        case EnemyState.Idle:\n            if (CanSeePlayer()) state = EnemyState.Chase;\n            break;\n        case EnemyState.Chase:\n            MoveToward(player);\n            if (InRange()) state = EnemyState.Attack;\n            break;\n    }\n}",
    "notes": "For complex FSMs, use Unity's Animator as a visual state machine. Scriptable-object-based FSMs scale better than switch statements."
  },
  {
    "pattern_id": "PAT_STATE_MACHINE",
    "engine": "unreal",
    "language": "cpp",
    "code": "// UE5: Use Gameplay Ability System or AI Controller states\nENUM(BlueprintType) enum class EEnemyState : uint8 {\n    Idle, Chase, Attack\n};\n\nvoid AEnemy::Tick(float DeltaTime) {\n    switch (CurrentState) {\n        case EEnemyState::Idle:\n            if (CanSeePlayer()) SetState(EEnemyState::Chase);\n            break;\n        // ...\n    }\n}",
    "notes": "UE5 AI uses Behavior Trees (preferred) or State Trees (UE5.4+). Use Blueprint enums for designer-visible states."
  },
  {
    "pattern_id": "PAT_STATE_MACHINE",
    "engine": "godot",
    "language": "gdscript",
    "code": "enum State { IDLE, CHASE, ATTACK }\nvar current_state: State = State.IDLE\n\nfunc _physics_process(delta: float) -> void:\n    match current_state:\n        State.IDLE:\n            if can_see_player():\n                current_state = State.CHASE\n        State.CHASE:\n            move_toward(player.position, speed * delta)\n            if in_range():\n                current_state = State.ATTACK",
    "notes": "For complex FSMs, use a State node pattern: each state is a child node with enter/exit/process methods. Godot 4 has no built-in FSM."
  },
  {
    "pattern_id": "PAT_ECS",
    "engine": "unity",
    "language": "csharp",
    "code": "// Unity DOTS ECS (Entities package):\npublic struct Velocity : IComponentData { public float3 Value; }\npublic struct Position : IComponentData { public float3 Value; }\n\n[BurstCompile]\npublic partial struct MoveSystem : ISystem {\n    public void OnUpdate(ref SystemState state) {\n        foreach (var (pos, vel) in\n            SystemAPI.Query<RefRW<Position>, RefRO<Velocity>>()) {\n            pos.ValueRW.Value += vel.ValueRO.Value * SystemAPI.Time.DeltaTime;\n        }\n    }\n}",
    "notes": "DOTS ECS requires Unity 2022.3+ with Entities package. Burst compiler required for performance. Hybrid renderer bridges ECS and GameObjects."
  },
  {
    "pattern_id": "PAT_ECS",
    "engine": "unreal",
    "language": "cpp",
    "code": "// UE5 Mass Entity (experimental ECS):\n// Define Fragment (component data):\nUSTRUCT() struct FMassVelocityFragment : public FMassFragment {\n    GENERATED_BODY()\n    FVector Velocity;\n};\n// Processor (system):\nvoid UMassMoveProcessor::Execute(\n    FMassEntityManager& EntityManager,\n    FMassExecutionContext& Context) {\n    // Process entity chunks with velocity + transform\n}",
    "notes": "Mass Entity is UE5's ECS framework. Still experimental. Most UE5 projects use traditional Actor/Component model instead."
  },
  {
    "pattern_id": "PAT_ECS",
    "engine": "godot",